[
  { "id": "swift", "name": { "zh": "神速", "en": "Swift" }, "category": "move", "description": "移动速度提升约 15%。", "tier": "rare" },
  { "id": "runner", "name": { "zh": "运动健将", "en": "Runner" }, "category": "move", "description": "长时间奔跑也不会消耗耐力。", "tier": "common" },
  { "id": "vicious", "name": { "zh": "凶猛", "en": "Vicious" }, "category": "attack", "description": "攻击力提升约 15%。", "tier": "rare" },
  { "id": "ferocious", "name": { "zh": "顽强", "en": "Ferocious" }, "category": "attack", "description": "攻击力与防御力小幅提升（约 +10%）。", "tier": "common" },
  { "id": "brawny", "name": { "zh": "壮汉", "en": "Brawny" }, "category": "attack", "description": "攻击力提升约 20%，工作速度略有下降。", "tier": "common" },
  { "id": "burly_body", "name": { "zh": "硬汉", "en": "Burly Body" }, "category": "defense", "description": "防御力提升约 20%。", "tier": "rare" },
  { "id": "hard_skin", "name": { "zh": "硬骨头", "en": "Hard Skin" }, "category": "defense", "description": "受到的伤害降低约 10%。", "tier": "common" },
  { "id": "glutton", "name": { "zh": "贪吃", "en": "Glutton" }, "category": "resource", "description": "进食后恢复更多饱食度，但也更容易饿。", "tier": "common" },
  { "id": "bottomless_stomach", "name": { "zh": "无底胃口", "en": "Bottomless Stomach" }, "category": "resource", "description": "饱食度下降速度更快。", "tier": "common" },
  { "id": "catcher", "name": { "zh": "捕手", "en": "Catcher" }, "category": "resource", "description": "捕获力提升约 30%。", "tier": "rare" },
  { "id": "artisan", "name": { "zh": "神匠", "en": "Artisan" }, "category": "work", "description": "工作速度大幅提升（约 +50%）。", "tier": "legendary" },
  { "id": "workaholic", "name": { "zh": "工作狂", "en": "Workaholic" }, "category": "work", "description": "几乎不休息，可长时间持续工作。", "tier": "common" },
  { "id": "diligent", "name": { "zh": "认真", "en": "Diligent" }, "category": "work", "description": "工作速度提升约 20%。", "tier": "common" },
  { "id": "lucky", "name": { "zh": "异色", "en": "Lucky" }, "category": "other", "description": "工作速度 +15%、攻击力 +15%（稀有变异）。", "tier": "legendary" },
  { "id": "early_bird", "name": { "zh": "早起鸟", "en": "Early Bird" }, "category": "other", "description": "夜晚也能正常工作。", "tier": "common" },
  { "id": "nocturnal", "name": { "zh": "夜猫子", "en": "Nocturnal" }, "category": "other", "description": "夜晚工作速度提升。", "tier": "common" },
  { "id": "sleepy", "name": { "zh": "爱睡", "en": "Sleepy" }, "category": "other", "description": "白天工作速度下降。", "tier": "common" },
  { "id": "heat_resistant", "name": { "zh": "耐热", "en": "Heat Resistant" }, "category": "other", "description": "受到的火属性伤害降低。", "tier": "common" },
  { "id": "cold_resistant", "name": { "zh": "耐寒", "en": "Cold Resistant" }, "category": "other", "description": "受到的冰属性伤害降低。", "tier": "common" },
  { "id": "pyromaniac", "name": { "zh": "火系亲和", "en": "Pyromaniac" }, "category": "element", "description": "火属性攻击伤害提升。", "tier": "rare" },
  { "id": "aquatic_affinity", "name": { "zh": "水系亲和", "en": "Aquatic Affinity" }, "category": "element", "description": "水属性攻击伤害提升。", "tier": "rare" },
  { "id": "botanist", "name": { "zh": "草系亲和", "en": "Botanist" }, "category": "element", "description": "草属性攻击伤害提升。", "tier": "rare" },
  { "id": "cryomaniac", "name": { "zh": "冰系亲和", "en": "Cryomaniac" }, "category": "element", "description": "冰属性攻击伤害提升。", "tier": "rare" },
  { "id": "empower_electric", "name": { "zh": "电系亲和", "en": "Empower Electric" }, "category": "element", "description": "电属性攻击伤害提升。", "tier": "rare" },
  { "id": "enduring_dark", "name": { "zh": "暗系亲和", "en": "Enduring Dark" }, "category": "element", "description": "暗属性攻击伤害提升。", "tier": "rare" },
  { "id": "empower_dragon", "name": { "zh": "龙系亲和", "en": "Empower Dragon" }, "category": "element", "description": "龙属性攻击伤害提升。", "tier": "rare" }
]
